1) Consider the relation employee (emp_id,e_name,salary ,Date of Joining,Dapt_no,Designation) perform basic SQL operations.
1.	Create table employee.
2.	Insert 10 records in table.

mysql> create table emp (emp_id int(10),e_name varchar(20),salary float(10),Date_of_Joining date,Dapt_no int(10),Designation varchar(20));
Query OK, 0 rows affected, 2 warnings (0.25 sec)

mysql> insert into emp values(1,"prerana",40000,'2022-01-11-',101,'manager');
Query OK, 1 row affected, 1 warning (0.05 sec)

mysql> insert into emp values(2,"panu",80000,'2022-01-11-',102,'manager');
Query OK, 1 row affected, 1 warning (0.02 sec)

mysql> insert into emp values(3,"kalpana",43000,'2022-01-01',103,'marketing_expert');
Query OK, 1 row affected (0.03 sec)

mysql> insert into emp values(4,"jaywant",13000,'2022-06-07',104,'professor');
Query OK, 1 row affected (0.03 sec)

mysql> insert into emp values(4,"hrushikesh",53000,'2022-06-02',105,'professor');
Query OK, 1 row affected (0.03 sec)

mysql> update emp set emp_id=5 where e_name="hrushikesh";
Query OK, 1 row affected (0.03 sec)
Rows matched: 1  Changed: 1  Warnings: 0

mysql> insert into emp values(6,"disha",23000,'2022-05-02',107,'resercher');
Query OK, 1 row affected (0.03 sec)

mysql> insert into emp values(7,"arya",23000,'2022-05-02',108,'department 1');
Query OK, 1 row affected (0.03 sec)

mysql> insert into emp values(8,"prisha",22000,'2022-05-02',108,'department 1');
Query OK, 1 row affected (0.03 sec)

mysql> insert into emp values(9,"ankita",22000,'2022-02-02',109,'department 2');
Query OK, 1 row affected (0.02 sec)

mysql> insert into emp values(10,"ankush",22000,'2022-02-08',109,'department 2');
Query OK, 1 row affected (0.03 sec)

mysql> insert into emp values(11,"puja",12000,'2022-02-08',109,'department 3');
Query OK, 1 row affected (0.03 sec)

mysql> insert into emp values(12,"pavan",52000,'2022-12-08',120,'department 4');
Query OK, 1 row affected (0.03 sec)

mysql> select * from emp;
+--------+------------+--------+-----------------+---------+------------------+
| emp_id | e_name     | salary | Date_of_Joining | Dapt_no | Designation      |
+--------+------------+--------+-----------------+---------+------------------+
|      1 | prerana    |  40000 | 2022-01-11      |     101 | manager          |
|      2 | panu       |  80000 | 2022-01-11      |     102 | manager          |
|      3 | kalpana    |  43000 | 2022-01-01      |     103 | marketing_expert |
|      4 | jaywant    |  13000 | 2022-06-07      |     104 | professor        |
|      5 | hrushikesh |  53000 | 2022-06-02      |     105 | professor        |
|      6 | disha      |  23000 | 2022-05-02      |     107 | resercher        |
|      7 | arya       |  23000 | 2022-05-02      |     108 | department 1     |
|      8 | prisha     |  22000 | 2022-05-02      |     108 | department 1     |
|      9 | ankita     |  22000 | 2022-02-02      |     109 | department 2     |
|     10 | ankush     |  22000 | 2022-02-08      |     109 | department 2     |
|     11 | puja       |  12000 | 2022-02-08      |     109 | department 3     |
|     12 | pavan      |  52000 | 2022-12-08      |     120 | department 4     |
+--------+------------+--------+-----------------+---------+------------------+
12 rows in set (0.03 sec)

3.	Create a view emp_vl of table employee which  has emp_id , name and dept-attributes.

mysql> create view emp_vl as select emp_id, e_name,Dapt_no,Designation from emp;
Query OK, 0 rows affected (0.04 sec)

mysql> select * from emp_vl;
+--------+------------+---------+------------------+
| emp_id | e_name     | Dapt_no | Designation      |
+--------+------------+---------+------------------+
|      1 | prerana    |     101 | manager          |
|      2 | panu       |     102 | manager          |
|      3 | kalpana    |     103 | marketing_expert |
|      4 | jaywant    |     104 | professor        |
|      5 | hrushikesh |     105 | professor        |
|      6 | disha      |     107 | resercher        |
|      7 | arya       |     108 | department 1     |
|      8 | prisha     |     108 | department 1     |
|      9 | ankita     |     109 | department 2     |
|     10 | ankush     |     109 | department 2     |
|     11 | puja       |     109 | department 3     |
|     12 | pavan      |     120 | department 4     |
+--------+------------+---------+------------------+
12 rows in set (0.03 sec)


4.	Create view of table.
mysql> create view emptable_view as select emp_id, e_name, salary,Date_of_Joining,Dapt_no,Designation from emp;
Query OK, 0 rows affected (0.01 sec)

mysql> select * from emptable_view;
+--------+------------+--------+-----------------+---------+------------------+
| emp_id | e_name     | salary | Date_of_Joining | Dapt_no | Designation      |
+--------+------------+--------+-----------------+---------+------------------+
|      1 | prerana    |  40000 | 2022-01-11      |     101 | manager          |
|      2 | panu       |  80000 | 2022-01-11      |     102 | manager          |
|      3 | kalpana    |  43000 | 2022-01-01      |     103 | marketing_expert |
|      4 | jaywant    |  13000 | 2022-06-07      |     104 | professor        |
|      5 | hrushikesh |  53000 | 2022-06-02      |     105 | professor        |
|      6 | disha      |  23000 | 2022-05-02      |     107 | resercher        |
|      7 | arya       |  23000 | 2022-05-02      |     108 | department 1     |
|      8 | prisha     |  22000 | 2022-05-02      |     108 | department 1     |
|      9 | ankita     |  22000 | 2022-02-02      |     109 | department 2     |
|     10 | ankush     |  22000 | 2022-02-08      |     109 | department 2     |
|     11 | puja       |  12000 | 2022-02-08      |     109 | department 3     |
|     12 | pavan      |  52000 | 2022-12-08      |     120 | department 4     |
+--------+------------+--------+-----------------+---------+------------------+
12 rows in set (0.03 sec)


5.	Update dept of any employee in view. Check whether it  gets updated or not.
mysql> update emp set Dapt_no=1 where e_name="panu";
Query OK, 1 row affected (0.03 sec)
Rows matched: 1  Changed: 1  Warnings: 0

mysql> select * from emp;
+--------+------------+--------+-----------------+---------+------------------+
| emp_id | e_name     | salary | Date_of_Joining | Dapt_no | Designation      |
+--------+------------+--------+-----------------+---------+------------------+
|      1 | prerana    |  40000 | 2022-01-11      |     101 | manager          |
|      2 | panu       |  80000 | 2022-01-11      |       1 | manager          |
|      3 | kalpana    |  43000 | 2022-01-01      |     103 | marketing_expert |
|      4 | jaywant    |  13000 | 2022-06-07      |     104 | professor        |
|      5 | hrushikesh |  53000 | 2022-06-02      |     105 | professor        |
|      6 | disha      |  23000 | 2022-05-02      |     107 | resercher        |
|      7 | arya       |  23000 | 2022-05-02      |     108 | department 1     |
|      8 | prisha     |  22000 | 2022-05-02      |     108 | department 1     |
|      9 | ankita     |  22000 | 2022-02-02      |     109 | department 2     |
|     10 | ankush     |  22000 | 2022-02-08      |     109 | department 2     |
|     11 | puja       |  12000 | 2022-02-08      |     109 | department 3     |
|     12 | pavan      |  52000 | 2022-12-08      |     120 | department 4     |
+--------+------------+--------+-----------------+---------+------------------+
12 rows in set (0.00 sec)
6.	Create emp_id as primary key 
mysql> alter table emp add primary key(emp_id);
Query OK, 0 rows affected (0.13 sec)
Records: 0  Duplicates: 0  Warnings: 0

mysql> desc emp;
+-----------------+-------------+------+-----+---------+-------+
| Field           | Type        | Null | Key | Default | Extra |
+-----------------+-------------+------+-----+---------+-------+
| emp_id          | int         | NO   | PRI | NULL    |       |
| e_name          | varchar(20) | YES  |     | NULL    |       |
| salary          | float       | YES  |     | NULL    |       |
| Date_of_Joining | date        | YES  |     | NULL    |       |
| Dapt_no         | int         | YES  |     | NULL    |       |
| Designation     | varchar(20) | YES  |     | NULL    |       |
+-----------------+-------------+------+-----+---------+-------+
6 rows in set (0.05 sec)

6.	Create emp_id as primary key and show indices on table employee.
7.	Show indices on table.
8.	Create user defined index on any column. 


create index i1 on emp(emp_id);

mysql> show index from emp;
+-------+------------+----------+--------------+-------------+-----------+-------------+----------+--------+------+------------+---------+---------------+---------+------------+
| Table | Non_unique | Key_name | Seq_in_index | Column_name | Collation | Cardinality | Sub_part | Packed | Null | Index_type | Comment | Index_comment | Visible | Expression |
+-------+------------+----------+--------------+-------------+-----------+-------------+----------+--------+------+------------+---------+---------------+---------+------------+
| emp   |          0 | PRIMARY  |            1 | emp_id      | A         |          12 |     NULL |   NULL |      | BTREE      |         |               | YES     | NULL       |
| emp   |          1 | i1       |            1 | emp_id      | A         |          12 |     NULL |   NULL |      | BTREE      |         |               | YES     | NULL       |
+-------+------------+----------+--------------+-------------+-----------+-------------+----------+--------+------+------------+---------+---------------+---------+------------+

mysql> create index i2 on emp(emp_id,e_name,Designation);


mysql> show index from emp;
+-------+------------+----------+--------------+-------------+-----------+-------------+----------+--------+------+------------+---------+---------------+---------+------------+
| Table | Non_unique | Key_name | Seq_in_index | Column_name | Collation | Cardinality | Sub_part | Packed | Null | Index_type | Comment | Index_comment | Visible | Expression |
+-------+------------+----------+--------------+-------------+-----------+-------------+----------+--------+------+------------+---------+---------------+---------+------------+
| emp   |          0 | PRIMARY  |            1 | emp_id      | A         |          12 |     NULL |   NULL |      | BTREE      |         |               | YES     | NULL       |
| emp   |          1 | i1       |            1 | emp_id      | A         |          12 |     NULL |   NULL |      | BTREE      |         |               | YES     | NULL       |
| emp   |          1 | i2       |            1 | emp_id      | A         |          12 |     NULL |   NULL |      | BTREE      |         |               | YES     | NULL       |
| emp   |          1 | i2       |            2 | e_name      | A         |          12 |     NULL |   NULL | YES  | BTREE      |         |               | YES     | NULL       |
| emp   |          1 | i2       |            3 | Designation | A         |          12 |     NULL |   NULL | YES  | BTREE      |         |               | YES     | NULL       |
+-------+------------+----------+--------------+-------------+-----------+-------------+----------+--------+------+------------+---------+---------------+---------+------------+


Prob 2 -------------------------------------------------------------------
1.	Display employees whose name contains letter ‘e’.

mysql> select emp_id,e_name,Designation from emp ;
+--------+------------+------------------+
| emp_id | e_name     | Designation      |
+--------+------------+------------------+
|      1 | prerana    | manager          |
|      2 | panu       | manager          |
|      3 | kalpana    | marketing_expert |
|      4 | jaywant    | professor        |
|      5 | hrushikesh | professor        |
|      6 | disha      | resercher        |
|      7 | arya       | department 1     |
|      8 | prisha     | department 1     |
|      9 | ankita     | department 2     |
|     10 | ankush     | department 2     |
|     11 | puja       | department 3     |
|     12 | pavan      | department 4     |
+--------+------------+------------------+
12 rows in set (0.00 sec)
2.	Display different types of designation


mysql> select emp_id,e_name,Dapt_no,Designation from emp where e_name like "%e%";
+--------+------------+---------+-------------+
| emp_id | e_name     | Dapt_no | Designation |
+--------+------------+---------+-------------+
|      1 | prerana    |     101 | manager     |
|      5 | hrushikesh |     105 | professor   |
+--------+------------+---------+-------------+
2 rows in set (0.03 sec)

3.	Display name and salary of employee whose location is Mumbai

mysql> select e_name,salary from emp where city="mumbai";
+---------+--------+
| e_name  | salary |
+---------+--------+
| prerana |  40000 |
| kalpana |  43000 |
| jaywant |  13000 |
| arya    |  23000 |
| prisha  |  22000 |
| ankita  |  22000 |
+---------+--------+
6 rows in set (0.00 sec)

4.	Display name and department of employee working in Manager or Marketing department

mysql> select e_name,Designation from emp where designation like "%manager" or "%marketing";
+---------+-------------+
| e_name  | Designation |
+---------+-------------+
| prerana | manager     |
| panu    | manager     |
+---------+-------------+
2 rows in set, 1 warning (0.00 sec)
5.	Display the department name whose employees are more than one

mysql>   SELECT  Designation
    -> FROM emp WHERE Designation IN
    -> (SELECT Designation FROM emp GROUP
    -> BY Designation HAVING COUNT(*)>1);
+--------------+
| Designation  |
+--------------+
| manager      |
| manager      |
| manager      |
| manager      |
| department 1 |
| department 1 |
| department 2 |
| department 2 |
+--------------+
8 rows in set (0.00 sec)

6.	Rename employee table as emp1
mysql> RENAME table emp TO emp1;
Query OK, 0 rows affected (0.04 sec)

7.	Add a new column city in the employee table.

mysql> alter table emp add column(city varchar(40));
Query OK, 0 rows affected (0.06 sec)
Records: 0  Duplicates: 0  Warnings: 0

this optional

mysql> Update  emp set city = "mumbai" where emp_id=1;
Query OK, 1 row affected (0.01 sec)
Rows matched: 1  Changed: 1  Warnings: 0

mysql> Update  emp set city = "mumbai" where emp_id=4;
Query OK, 1 row affected (0.03 sec)
Rows matched: 1  Changed: 1  Warnings: 0

mysql> Update  emp set city = "pune" where emp_id=2;
Query OK, 1 row affected (0.03 sec)
Rows matched: 1  Changed: 1  Warnings: 0

mysql> Update  emp set city = "mumbai" where emp_id=7;
Query OK, 1 row affected (0.00 sec)
Rows matched: 1  Changed: 1  Warnings: 0

mysql> Update  emp set city = "mumbai" where emp_id=8;
Query OK, 1 row affected (0.00 sec)
Rows matched: 1  Changed: 1  Warnings: 0

mysql> Update  emp set city = "mumbai" where emp_id=9;
Query OK, 1 row affected (0.03 sec)
Rows matched: 1  Changed: 1  Warnings: 0

mysql> Update  emp set city = "pune" where emp_id=10;
Query OK, 1 row affected (0.03 sec)
Rows matched: 1  Changed: 1  Warnings: 0

mysql> Update  emp set city = "pune" where emp_id=11;
Query OK, 1 row affected (0.03 sec)
Rows matched: 1  Changed: 1  Warnings: 0

mysql> select * from emp;
+--------+------------+--------+-----------------+---------+------------------+--------+
| emp_id | e_name     | salary | Date_of_Joining | Dapt_no | Designation      | city   |
+--------+------------+--------+-----------------+---------+------------------+--------+
|      1 | prerana    |  40000 | 2022-01-11      |     101 | manager          | mumbai |
|      2 | panu       |  80000 | 2022-01-11      |       1 | manager          | pune   |
|      3 | kalpana    |  43000 | 2022-01-01      |     103 | marketing_expert | NULL   |
|      4 | jaywant    |  13000 | 2022-06-07      |     104 | professor        | mumbai |
|      5 | hrushikesh |  53000 | 2022-06-02      |     105 | professor        | NULL   |
|      6 | disha      |  23000 | 2022-05-02      |     107 | resercher        | NULL   |
|      7 | arya       |  23000 | 2022-05-02      |     108 | department 1     | mumbai |
|      8 | prisha     |  22000 | 2022-05-02      |     108 | department 1     | mumbai |
|      9 | ankita     |  22000 | 2022-02-02      |     109 | department 2     | mumbai |
|     10 | ankush     |  22000 | 2022-02-08      |     109 | department 2     | pune   |
|     11 | puja       |  12000 | 2022-02-08      |     109 | department 3     | pune   |
|     12 | pavan      |  52000 | 2022-12-08      |     120 | department 4     | NULL   |
+--------+------------+--------+-----------------+---------+------------------+--------+
12 rows in set (0.00 sec)


1.	Find department in which maximum employees work.

 SELECT  Designation, COUNT(*) AS MAX_NO_OF_EMPLOYEES
    -> FROM emp1
    -> GROUP BY Designation
    -> ORDER BY COUNT(*) DESC;
+------------------+---------------------+
| Designation      | MAX_NO_OF_EMPLOYEES |
+------------------+---------------------+
| manager          |                   4 |
| department 1     |                   2 |
| department 2     |                   2 |
| marketing_expert |                   1 |
| professor        |                   1 |
| department 3     |                   1 |
| department 4     |                   1 |
+------------------+---------------------+
7 rows in set (0.00 sec)


2.	 Display name, designation and department no of employees whose name starts with either ‘A’ or ‘P’.
3.	 Display max. salary from department 2 and min. salary from department 4.
4.	 Display employee data where salary is less than average salary from department 3.
5.	 Display employees who were hired earliest or latest.
6.	Display name and department no of employees who are manager, market analysts. Use prediactes
7.	List employees hired in August.
8.	 List employees who are hired after 31/12/2006.
9.	 Find average annual salary per department.



select e_name,Dapt_no,Designation from emp1 where e_name like "A%" or "p%";
+--------+---------+--------------+
| e_name | Dapt_no | Designation  |
+--------+---------+--------------+
| arya   |     108 | department 1 |
| ankita |     109 | department 2 |
| ankush |     109 | department 2 |
+--------+---------+--------------+

select max(salary) from emp1 where Designation="department 2" ;
+-------------+
| max(salary) |
+-------------+
|       22000 |
+-------------+
1 row in set (0.00 sec)

mysql>   select min(salary) from emp1 where Designation=" department 4";
+-------------+
| min(salary) |
+-------------+
|        NULL |
+-------------+
1 row in set (0.00 sec)


mysql> SELECT Designation,
    -> avg(salary)
    -> FROM emp1
    -> GROUP BY Designation
    -> HAVING avg(salary) <
    ->   (SELECT avg(salary)
    ->    FROM emp1);
+--------------+-------------+
| Designation  | avg(salary) |
+--------------+-------------+
| professor    |       13000 |
| department 1 |       22500 |
| department 2 |       22000 |
| department 3 |       12000 |
+--------------+-------------+
4 rows in set (0.03 sec)

mysql> SELECT *
    -> FROM emp1
    -> WHERE Date_of_Joining > 31/12/2006;
+--------+------------+--------+-----------------+---------+------------------+--------+
| emp_id | e_name     | salary | Date_of_Joining | Dapt_no | Designation      | city   |
+--------+------------+--------+-----------------+---------+------------------+--------+
|      1 | prerana    |  40000 | 2022-01-11      |     101 | manager          | mumbai |
|      2 | panu       |  80000 | 2022-01-11      |       1 | manager          | pune   |
|      3 | kalpana    |  43000 | 2022-01-01      |     103 | marketing_expert | mumbai |
|      4 | jaywant    |  13000 | 2022-06-07      |     104 | professor        | mumbai |
|      5 | hrushikesh |  53000 | 2022-06-02      |     105 | manager          | pune   |
|      6 | disha      |  23000 | 2022-05-02      |     107 | manager          | pune   |
|      7 | arya       |  23000 | 2022-05-02      |     108 | department 1     | mumbai |
|      8 | prisha     |  22000 | 2022-05-02      |     108 | department 1     | mumbai |
|      9 | ankita     |  22000 | 2022-02-02      |     109 | department 2     | mumbai |
|     10 | ankush     |  22000 | 2022-02-08      |     109 | department 2     | pune   |
|     11 | puja       |  12000 | 2022-02-08      |     109 | department 3     | pune   |
|     12 | pavan      |  52000 | 2022-12-08      |     120 | department 4     | pune   |
+--------+------------+--------+-----------------+---------+------------------+--------+
12 rows in set (0.03 sec)

mysql> SELECT Designation,AVG(salary) AS
    -> AVERAGE_SALARY FROM emp1 GROUP BY Designation;
+------------------+----------------+
| Designation      | AVERAGE_SALARY |
+------------------+----------------+
| manager          |          49000 |
| marketing_expert |          43000 |
| professor        |          13000 |
| department 1     |          22500 |
| department 2     |          22000 |
| department 3     |          12000 |
| department 4     |          52000 |
+------------------+----------------+
7 rows in set (0.00 sec)